name,kind,family,version,path,scope
ieee-ablation-study,core,ieee,0.5.0,skills/ieee-ablation-study,"ablation design, component-level evidence, sensitivity analysis, and mechanism validation."
ieee-abstract,core,ieee,0.5.0,skills/ieee-abstract,"abstract drafting, compression, claim discipline, and contribution evidence alignment."
ieee-abstract-index-terms,core,ieee,0.5.0,skills/ieee-abstract-index-terms,"abstract compression, contribution density, index term hygiene."
ieee-access-writing,journal-adapter,ieee,0.5.0,skills/ieee-access-writing,"multidisciplinary open-access IEEE articles with clear contribution, validation, and broad technical relevance."
ieee-acknowledgment-first-footnote,core,ieee,0.5.0,skills/ieee-acknowledgment-first-footnote,"IEEE acknowledgments, funding first-footnote handling, AI disclosure placement, and author-note consistency."
ieee-ai-disclosure-integrity,core,ieee,0.5.0,skills/ieee-ai-disclosure-integrity,"transparent AI-assisted writing, plagiarism avoidance, citation integrity, and author-responsibility reminders."
ieee-algorithm-pseudocode,core,ieee,0.5.0,skills/ieee-algorithm-pseudocode,"algorithm boxes, pseudocode, complexity notes, and stepwise method communication."
ieee-appendix,core,ieee,0.5.0,skills/ieee-appendix,"appendices, extended derivations, extra tables, and material that should not interrupt the main paper."
ieee-artifact-availability,core,ieee,0.5.0,skills/ieee-artifact-availability,"code, data, model, environment, reproducibility package, and artifact statement preparation."
ieee-author-agreement,core,ieee,0.5.0,skills/ieee-author-agreement,"publishing agreement readiness, author rights reminders, copyright form/license route, and post-acceptance decisions."
ieee-author-contribution,core,ieee,0.5.0,skills/ieee-author-contribution,"author contribution statements, accountability, approval, and corresponding-author coordination."
ieee-baseline-selection,core,ieee,0.5.0,skills/ieee-baseline-selection,"baseline choice, reimplementation fairness, hyperparameter disclosure, and comparison scope."
ieee-caption,core,ieee,0.5.0,skills/ieee-caption,"figure and table captions, legends, abbreviation expansion, symbol explanation, and standalone interpretability."
ieee-checklist-risk-register,core,ieee,0.5.0,skills/ieee-checklist-risk-register,"pre-submission checklist, reviewer-risk register, desk-rejection risk, and issue prioritization."
ieee-citation,core,ieee,0.5.0,skills/ieee-citation,citation placement and bibliography-risk audit.
ieee-competing-interest,core,ieee,0.5.0,skills/ieee-competing-interest,"competing-interest declarations, editorial role conflicts, financial relationships, and disclosure completeness."
ieee-component-router,router,ieee,0.5.0,skills/ieee-component-router,"detect manuscript components such as table, figure, caption, related work, method, experiment, ablation, references, declarations, and route them to the correct component skills. Use for IEEE Transactions, Journals, Letters, and IEEE-style technical journal writing."
ieee-conclusion,core,ieee,0.5.0,skills/ieee-conclusion,"conclusion concision, contribution recap, implications, and no-new-claim discipline."
ieee-conference-extension,core,ieee,0.5.0,skills/ieee-conference-extension,journal extension from conference papers.
ieee-conference-extension-delta,core,ieee,0.5.0,skills/ieee-conference-extension-delta,"conference-to-journal extension gap, overlap disclosure, new material, and contribution delta."
ieee-contribution-positioning,core,ieee,0.5.0,skills/ieee-contribution-positioning,"contribution statements, novelty claims, conference-extension delta, and reviewer-facing positioning."
ieee-copyright-license,core,ieee,0.5.0,skills/ieee-copyright-license,"copyright, license options, figure/table reuse permissions, and rights-risk audit."
ieee-cover-letter,core,ieee,0.5.0,skills/ieee-cover-letter,journal submission cover letter.
ieee-cover-letter-fit-statement,core,ieee,0.5.0,skills/ieee-cover-letter-fit-statement,"cover letter, scope fit statement, novelty framing, prior-publication disclosure, and editor-facing summary."
ieee-data-code-availability,core,ieee,0.5.0,skills/ieee-data-code-availability,"data/code availability, artifact links, reproducibility statements, repository hygiene, and license clarity."
ieee-dataset-protocol,core,ieee,0.5.0,skills/ieee-dataset-protocol,"dataset description, preprocessing, train/validation/test splits, leakage control, and benchmark protocol."
ieee-discussion,core,ieee,0.5.0,skills/ieee-discussion,"discussion section interpretation, implications, comparison to prior work, and evidence-bounded claims."
ieee-editorial-screening,core,ieee,0.5.0,skills/ieee-editorial-screening,"desk-rejection risk, scope fit, novelty, formatting, ethics, and completeness audit."
ieee-equation,core,ieee,0.5.0,skills/ieee-equation,"equation formatting, notation consistency, numbered equations, and mathematical readability."
ieee-ethics-limitations,core,ieee,0.5.0,skills/ieee-ethics-limitations,"limitations, responsible AI, dataset bias, human/medical/security risk, and dual-use disclosure prompts."
ieee-experiment-ablation,core,ieee,0.5.0,skills/ieee-experiment-ablation,"experimental design, baseline fairness, ablations, robustness, and failure analysis."
ieee-experimental-design,core,ieee,0.5.0,skills/ieee-experimental-design,"experiment plan, validation logic, dataset split, protocol, controls, and fairness of comparisons."
ieee-figure,core,ieee,0.5.0,skills/ieee-figure,"figures, panels, visual evidence, resolution/readability, accessibility, and text-reference order."
ieee-figure-table,core,ieee,0.5.0,skills/ieee-figure-table,"IEEE-style figures, tables, captions, and evidence layout."
ieee-final-production-files,core,ieee,0.5.0,skills/ieee-final-production-files,"accepted-paper final files, source files, graphics, tables, author photos, and production handoff."
ieee-funding-acknowledgment,core,ieee,0.5.0,skills/ieee-funding-acknowledgment,"funding statement, grant identifiers, sponsor role, and acknowledgment placement."
ieee-graphical-abstract,core,ieee,0.5.0,skills/ieee-graphical-abstract,"IEEE graphical abstracts when required or allowed, peer-review upload, visual summary, and policy compliance."
ieee-index-terms,core,ieee,0.5.0,skills/ieee-index-terms,"IEEE Index Terms selection, controlled terminology, and term consistency."
ieee-introduction,core,ieee,0.5.0,skills/ieee-introduction,"introduction framing, problem-gap-contribution logic, and audience fit."
ieee-introduction-related-work,core,ieee,0.5.0,skills/ieee-introduction-related-work,problem-gap-contribution framing and prior-work positioning.
ieee-journal-router,router,ieee,0.5.0,skills/ieee-journal-router,"detect target journals and route to the correct independent journal adapter while preserving publisher-family boundaries and official URL checks. Use for IEEE Transactions, Journals, Letters, and IEEE-style technical journal writing."
ieee-latex-source-package,core,ieee,0.5.0,skills/ieee-latex-source-package,"LaTeX source package, class/style files, BibTeX, figures, and compilation-risk audit."
ieee-latex-template-audit,core,ieee,0.5.0,skills/ieee-latex-template-audit,"IEEE template-readiness, source package hygiene, equations, captions, and references."
ieee-limitations,core,ieee,0.5.0,skills/ieee-limitations,"honest limitations, failure cases, boundary conditions, ethics, and future work without self-sabotage."
ieee-math-notation,core,ieee,0.5.0,skills/ieee-math-notation,"mathematical notation, assumptions, theorem statements, equations, and symbol consistency."
ieee-method-algorithm,core,ieee,0.5.0,skills/ieee-method-algorithm,"method exposition, notation, algorithms, architecture, and implementation clarity."
ieee-method-details,core,ieee,0.5.0,skills/ieee-method-details,"method section completeness, implementation clarity, architectural motivation, and reproducibility details."
ieee-metrics-evaluation,core,ieee,0.5.0,skills/ieee-metrics-evaluation,"metric selection, evaluation definitions, reporting precision, and interpretation boundaries."
ieee-multimedia-supplement,core,ieee,0.5.0,skills/ieee-multimedia-supplement,"videos, code demos, multimedia items, file captions, and supplementary upload package."
ieee-official-source-audit,core,ieee,0.5.0,skills/ieee-official-source-audit,"mapping workflow rules to IEEE Author Center, target-publication instructions, templates, style manuals, and policy checkpoints before making submission-readiness claims."
ieee-open-access-decision,core,ieee,0.5.0,skills/ieee-open-access-decision,"open access route, funder mandate, license implications, APC reminder, and institutional agreement check."
ieee-polishing,core,ieee,0.5.0,skills/ieee-polishing,technical English polishing for IEEE-style manuscripts.
ieee-preprint-prior-publication,core,ieee,0.5.0,skills/ieee-preprint-prior-publication,"preprint status, prior conference version disclosure, simultaneous submission, and overlap audit."
ieee-problem-formulation,core,ieee,0.5.0,skills/ieee-problem-formulation,"problem definition, assumptions, input-output contract, variables, constraints, and task setup."
ieee-proof-correction,core,ieee,0.5.0,skills/ieee-proof-correction,"proof review, correction discipline, author queries, metadata checks, and post-acceptance risk control."
ieee-reference-integrity,core,ieee,0.5.0,skills/ieee-reference-integrity,"reference completeness, citation order, related-work coverage, and anti-fabrication checks."
ieee-related-work,core,ieee,0.5.0,skills/ieee-related-work,"related work taxonomy, prior-art contrast, citation positioning, and novelty boundaries."
ieee-reproducibility-check,core,ieee,0.5.0,skills/ieee-reproducibility-check,pre-submission reproducibility and evidence audit.
ieee-response,core,ieee,0.5.0,skills/ieee-response,response to reviewer comments for IEEE journals.
ieee-results-reporting,core,ieee,0.5.0,skills/ieee-results-reporting,"results narrative, table/figure coordination, statistical strength, and non-cherry-picked reporting."
ieee-reviewer,core,ieee,0.5.0,skills/ieee-reviewer,pre-submission review simulation for IEEE-style manuscripts.
ieee-reviewer-response-matrix,core,ieee,0.5.0,skills/ieee-reviewer-response-matrix,"point-by-point response matrix, editor letter alignment, change tracking, and tone control."
ieee-revision-diff,core,ieee,0.5.0,skills/ieee-revision-diff,"revision plan, manuscript change log, response evidence, and clean/marked manuscript coordination."
ieee-revision-strategy,core,ieee,0.5.0,skills/ieee-revision-strategy,"major/minor revision planning, experiment triage, response strategy, and change log."
ieee-skill-suite,router,ieee,0.5.0,skills/ieee-skill-suite,"route manuscript requests across journal adapters, component skills, submission-policy skills, official-source audits, and compact/full suite installation modes. Use for IEEE Transactions, Journals, Letters, and IEEE-style technical journal writing."
ieee-statistical-reporting,core,ieee,0.5.0,skills/ieee-statistical-reporting,"confidence intervals, variance, significance testing, robustness, and repeated-run reporting."
ieee-submission-metadata,core,ieee,0.5.0,skills/ieee-submission-metadata,"submission portal metadata, article type, author information, declarations, and upload package checks."
ieee-submission-router,router,ieee,0.5.0,skills/ieee-submission-router,"route submission workflows such as cover letter, author agreement, copyright/license, open access, revision response, final files, proof correction, and official-source checks. Use for IEEE Transactions, Journals, Letters, and IEEE-style technical journal writing."
ieee-supplementary-files,core,ieee,0.5.0,skills/ieee-supplementary-files,"supplementary material organization, file captions, cross-references, and peer-review compatibility."
ieee-supplementary-material,core,ieee,0.5.0,skills/ieee-supplementary-material,"supplementary appendix planning, extra experiments, proofs, data sheets, and demo links."
ieee-table,core,ieee,0.5.0,skills/ieee-table,"submission-ready tables, editable table text, caption logic, notes, abbreviations, and non-duplicative presentation."
ieee-template-paper-miner,core,ieee,0.5.0,skills/ieee-template-paper-miner,using the bundled CC-BY/open-access IEEE template corpus to extract structural patterns without copying scientific content.
ieee-theory-proof,core,ieee,0.5.0,skills/ieee-theory-proof,"theoretical analysis, propositions, assumptions, proof sketches, and mathematical rigor."
ieee-title-author-metadata,core,ieee,0.5.0,skills/ieee-title-author-metadata,"title, author metadata, affiliations, corresponding author details, and front-matter integrity."
ieee-visual-accessibility,core,ieee,0.5.0,skills/ieee-visual-accessibility,"color accessibility, figure readability, font size, grayscale safety, and accessibility-aware graphics."
ieee-writing,core,ieee,0.5.0,skills/ieee-writing,IEEE Transactions and Journals manuscript drafting.
intelligent-transportation-systems-writing,journal-adapter,ieee,0.5.0,skills/intelligent-transportation-systems-writing,"intelligent transportation, autonomous driving, traffic prediction, vehicle infrastructure systems."
jbhi-writing,journal-adapter,ieee,0.5.0,skills/jbhi-writing,"biomedical and health informatics, clinical AI, digital health systems."
pami-writing,journal-adapter,ieee,0.5.0,skills/pami-writing,"computer vision, pattern analysis, machine learning, recognition, representation learning."
tac-writing,journal-adapter,ieee,0.5.0,skills/tac-writing,"control theory, systems, stability, optimization, estimation, and rigorous proofs."
tai-writing,journal-adapter,ieee,0.5.0,skills/tai-writing,"artificial intelligence methods, systems, learning algorithms, and applied AI validation."
tase-writing,journal-adapter,ieee,0.5.0,skills/tase-writing,"automation science, manufacturing systems, logistics, robotics for automation, decision/control systems."
tcomm-writing,journal-adapter,ieee,0.5.0,skills/tcomm-writing,"communication theory, wireless systems, coding, networking, signal processing for communications."
tcsvt-writing,journal-adapter,ieee,0.5.0,skills/tcsvt-writing,"video technology, image/video coding, multimedia systems, visual signal processing."
tcyb-writing,journal-adapter,ieee,0.5.0,skills/tcyb-writing,"cybernetics, computational intelligence, machine learning, control, human-machine systems."
tgrs-writing,journal-adapter,ieee,0.5.0,skills/tgrs-writing,"geoscience and remote sensing, earth observation, hyperspectral/SAR/optical analysis."
tifs-writing,journal-adapter,ieee,0.5.0,skills/tifs-writing,"information forensics, security, privacy, biometrics, trustworthy media."
tip-writing,journal-adapter,ieee,0.5.0,skills/tip-writing,"image processing, restoration, enhancement, compression, analysis, computational imaging."
tkde-writing,journal-adapter,ieee,0.5.0,skills/tkde-writing,"data engineering, knowledge discovery, databases, graph mining, information retrieval."
tmi-writing,journal-adapter,ieee,0.5.0,skills/tmi-writing,"medical imaging, image reconstruction, segmentation, diagnosis assistance, quantitative imaging."
tmm-writing,journal-adapter,ieee,0.5.0,skills/tmm-writing,"multimedia analysis, multimodal learning, retrieval, generation, interaction."
tnnls-writing,journal-adapter,ieee,0.5.0,skills/tnnls-writing,"neural networks, learning systems, optimization, theory, adaptive systems."
tpel-writing,journal-adapter,ieee,0.5.0,skills/tpel-writing,"power electronics, converters, control, reliability, hardware experiments, and energy systems."
tro-writing,journal-adapter,ieee,0.5.0,skills/tro-writing,"robotics algorithms, perception, planning, control, manipulation, field validation."
tsp-writing,journal-adapter,ieee,0.5.0,skills/tsp-writing,"signal processing theory, algorithms, estimation, detection, optimization."
tvcg-writing,journal-adapter,ieee,0.5.0,skills/tvcg-writing,"visualization, visual analytics, graphics, VR/AR, human-centered visual computing."
twc-writing,journal-adapter,ieee,0.5.0,skills/twc-writing,"wireless communication systems, MIMO, networks, resource allocation, 6G-related methods."
