id,journal,year,title,file,source_url,license,template_use,not_for,size_bytes,sha256
pr-2024-linear-transportation-lp-distance,Pattern Recognition,2024,A linear transportation Lp distance for pattern recognition,open_access_papers/pattern_recognition_2024_linear_transportation_lp_distance_ccby.pdf,https://wrap.warwick.ac.uk/id/eprint/185436/13/1-s2.0-S003132032300777X-main.pdf,Creative Commons Attribution 4.0 (CC BY 4.0),"Pattern Recognition technical article anatomy, theoretical-method contribution, experimental validation narrative.",Do not reuse theorem/algorithm language or paper-specific claims.,3169289,7a3d2b811060ddf6e798cdd3f1c7cbb8a26deed0ab30226f46ae3a158061ce3b
prl-2023-too-good-prior,Pattern Recognition Letters,2023,A too-good-to-be-true prior to reduce shortcut reliance,open_access_papers/pattern_recognition_letters_2023_too_good_to_be_true_prior_ccby.pdf,https://juser.fz-juelich.de/record/1024830/files/1-s2.0-S0167865522003841-main-1.pdf,Creative Commons Attribution 4.0 (CC BY 4.0),"Short-format argument, compact experiment reporting, PRL-style concise contribution packaging.",Do not copy compact phrasing or the shortcut-learning framing as boilerplate.,1522798,74d8c59831295aac4d31ed6094cae66c50891da85cad3a8b00cdcd4ac7dbe1f8
eswa-2024-knowledge-based-ai,Expert Systems With Applications,2024,Enhancing vessel arrival time prediction: A fusion-based deep learning approach,open_access_papers/eswa_2024_knowledge_based_ai_template_ccby.pdf,https://pure.uva.nl/ws/files/204160450/1-s2.0-S0957417424008546-main.pdf,Creative Commons Attribution 4.0 (CC BY 4.0),"Fusion-based deep learning application framing, applied prediction evaluation, practical decision-support discussion style.",Do not reuse vessel-arrival, logistics, or dataset-specific claims.,11511715,3e974cc242ed646bb550cee1e2c8c88f42c3f3fee0afa9ac1914993c3328c0bc
neurocomputing-2024-xai-cybersecurity,Neurocomputing,2024,Advanced insights through systematic analysis: Mapping future research directions and opportunities for xAI in deep learning and artificial intelligence used in cybersecurity,open_access_papers/neurocomputing_2024_xai_systematic_analysis_ccby.pdf,https://www.starlight-h2020.eu/sites/default/files/2024-05/Advanced%20insights%20through%20systematic%20analysis.pdf,Creative Commons Attribution 4.0 (CC BY 4.0),"Neurocomputing survey/analysis structure, research-direction synthesis, technical taxonomy with applied context.","Do not copy taxonomy, research questions, or field-specific conclusions.",1893851,c5873766393024cf640ade837c68d7a236c986c8b6f1daf53874028ccbe13395
information-sciences-2025-gkf-pual,Information Sciences,2025,GKF-PUAL: A group kernel-free approach to positive-unlabeled learning with variable selection,open_access_papers/information_sciences_2025_gkf_pual_ccby.pdf,https://openaccess.city.ac.uk/id/eprint/33901/8/1-s2.0-S0020025524014889-main.pdf,Creative Commons Attribution 4.0 (CC BY 4.0),"Information Sciences method naming, algorithmic contribution, variable-selection evaluation, discussion/conclusion balance.",Do not reuse algorithm naming or variable-selection claims.,634360,94a8a423ae2b43412ca59c41df2500c98c8104bb87451578e11c780aaa71f46a
kbs-2023-alzheimers-explainable-ai,Knowledge-Based Systems,2023,Adazd-Net: Automated adaptive and explainable Alzheimer’s disease detection system using EEG signals,open_access_papers/kbs_2023_alzheimers_explainable_ai_ccby.pdf,https://pure.au.dk/ws/files/401416437/1-s2.0-S0950705123006081-main.pdf,Creative Commons Attribution 4.0 (CC BY 4.0),"KBS application/method blend, adaptive/explainable AI framing, biomedical signal validation and limitations.","Do not copy medical conclusions, EEG figures, adaptive-wavelet claims, or case-study-specific text.",3058465,0fc17364b4c048730f2994b42771bd75fdf06d6f5b07e0176a215b12cf764104
