id,journal,year,title,file,source_url,license,template_use,not_for,size_bytes,sha256
tpami-2023-transformers-survey,IEEE TPAMI,2023,Multimodal Learning With Transformers: A Survey,open_access_papers/tpami_2023_multimodal_learning_with_transformers_ccby.pdf,https://eng.ox.ac.uk/media/ttrg2f51/2023-ieee-px.pdf,Creative Commons Attribution 4.0 (CC BY 4.0),"Survey structure, taxonomy-driven related work, dense sectioning, visual overview tables, TPAMI-style synthesis.","Do not copy survey taxonomy, wording, figures, or paper-specific claims.",1523350,e21ed49574fbf5f37b265b70fa954cbb085af9f31d58faff6548084fab4723f0
tip-2022-see360,IEEE TIP,2022,See360: Novel Panoramic View Interpolation,open_access_papers/tip_2022_see360_panoramic_view_interpolation_ccby.pdf,https://ira.lib.polyu.edu.hk/bitstream/10397/96492/1/See360_Novel_Panoramic_View_Interpolation.pdf,Creative Commons Attribution 4.0 (CC BY 4.0),"Image-processing method exposition, visual-result comparison, ablation rhythm, quantitative/qualitative evidence pairing.",Do not reuse images or claims without attribution and permission checks.,4644857,b39b20e9039c6e618a9fa568873d2f3d9222201c234f0ecdc32c5d6df083156a
tmi-2020-lesion-localization,IEEE TMI,2020,Iterative Augmentation of Visual Evidence for Weakly Supervised Lesion Localization in Deep Interpretability Frameworks: Application to Color Fundus Images,open_access_papers/tmi_2020_weakly_supervised_lesion_localization_ccby.pdf,https://pure.uva.nl/ws/files/68020849/Iterative_Augmentation_of_Visual_Evidence_for_Weakly_Supervised_Lesion_Localization_in_Deep_Interpretability_Frameworks_Application_to_Color_Fundus_Images.pdf,Creative Commons Attribution 4.0 (CC BY 4.0),"Medical-imaging motivation, dataset/clinical-context framing, interpretability evidence, risk-aware experimental presentation.","Do not borrow medical claims, patient/data statements, or regulatory implications.",47795920,459669e80fca58617e6ecbcef60b63d776383c85257485e5d55630dbbf4e85c2
tnnls-2023-sparce,IEEE TNNLS,2023,SpaRCe: Improved Learning of Reservoir Computing Systems Through Sparse Representations,open_access_papers/tnnls_2023_sparce_sparse_reservoir_computing_ccby.pdf,https://eprints.whiterose.ac.uk/id/eprint/241349/1/SpaRCe_Improved_Learning_of_Reservoir_Computing_Systems_Through_Sparse_Representations.pdf,Creative Commons Attribution 4.0 (CC BY 4.0),"Learning-systems method narrative, theoretical/method motivation, equations plus experiments.","Do not reuse algorithms, notation, or equations unless properly cited and scientifically relevant.",3282635,c1e2b20b4f05308157a4c004efdf2c1d07862f8d8cd375ca00245008c31e2ab1
tnnls-2024-mediterranean,IEEE TNNLS,2024,Fully Connected Networks on a Diet With the Mediterranean Matrix Multiplication,open_access_papers/tnnls_2024_mediterranean_matrix_multiplication_ccby.pdf,https://cronfa.swan.ac.uk/Record/cronfa60038/Download/60038__31356__0b683a7201f540b89f3f8ca0f373040d.pdf,Creative Commons Attribution 4.0 (CC BY 4.0),"Compact theory-to-experiment flow, mathematical contribution framing, complexity/efficiency storyline.","Do not reuse method name, derivations, or benchmark interpretation as generic language.",4153630,45a7ade03f8a54947c7e5b25275159d605ef176942d87c36ade794ff2d119b48
